"James Abercrombie James Abercrombie 8 Hanbury Drive, Calcot RG31 7EJ (0118) 602 4786"
"Amran Ahmad Amran Ahmad 34 Ashley Road, Bradford-On-Avon BA15 1RT (01225) 102717"
"Steven Alexander Steven Alexander Danes Court Cottage, Cartmel Fell LA11 6NT (015395) 64146"
"Philip Andrews Philip Andrews 4 Naas Lane, Lydney GL15 5AW (01594) 188536"
"Iain Arbuckle Iain Arbuckle 6 Churchill Avenue, Wellingborough NN8 5YG (01933) 127372"
"Steven Bailey Steven Bailey 39 Addison Crescent, Manchester M16 0WN (0161) 000 0058"
"Tristan Bailey Tristan Bailey 22 Parkers Road, Crewe CW1 4GA (01270) 805443"
"Anthony Bartlett Anthony Bartlett 44 Cliff Road, Newquay TR7 2ND (01637) 405111"
"Mark Bateman Mark Bateman 8 Grenville Avenue, Goring By Sea BN12 6JE (01903) 714834"
"Karina Batra Karina Batra 9 Warren Chase, Kesgrave IP5 2WZ (01473) 050287"
"Rowena Beaton Rowena Beaton 11 Buttercup Square, Stanwell TW19 7UD (01784) 552224"
"Maria Beattie Maria Beattie 12A Allott Street, Hoyland S74 0NF (01226) 203378"
"Young Bellis Young Bellis 34 Hilperton Road, Trowbridge BA14 7JD (01225) 372424"
"Elizabeth Bennett Elizabeth Bennett 77 Cedarwood Glade, Stainton TS8 9DL (01642) 158401"
"Stephen Black Stephen Black 88 Needham Drive, Workington CA14 3SE (01900) 427372"
"Stuart Blank Stuart Blank 128A Commercial Street, Maesteg CF34 9DW (01639) 608577"
"Anne Bonnett Anne Bonnett Flat 3, Whitehaugh Court, Church Road, Eastleigh SO50 6DF (01489) 672467"
"Anthony Bowen Anthony Bowen 42 Klondyke Way, Asfordby LE14 3TW (01664) 506383"
"Stepehn Bradly Stepehn Bradly 3 Gillford Crescent, Carlisle CA1 3BS (01228) 701144"
"David Bradney David Bradney Awel Mon, Marianglas LL73 8PF (01248) 858652"
"Chris Bramham Chris Bramham 3 Lower Grosvenor Place, London SW1W 0EJ (020) 8310 6207"
"Scott Bramley Scott Bramley 82 Jordan Avenue, Stretton DE13 0JB (01283) 540112"
"Mary Brown Mary Brown 109A Havant Road, Drayton PO6 2AH (01329) 482088"
"Strachan Bruce Strachan Bruce 10 Evesham Close, Boldon Colliery NE35 9LL (0191) 708 7845"
"Agnes Buntain Agnes Buntain Foxpark Farm, Newton Le Willows DL8 1RZ (01677) 356575"
"Stephen Burd Stephen Burd 6 John Street, Swan Village B70 0AB (01384) 187473"
"Barbara Butler Barbara Butler 3 Little Court Close, Midhurst GU29 9SS (01428) 837643"
"Margaret Carr Margaret Carr The Old Vicarage, Crosthwaite LA8 8BP (01539) 406041"
"Anne Carruth Anne Carruth Eastfield, Roughton Moor LN10 6YQ (01526) 523308"
"Ryan Carson Ryan Carson 78 Altrincham Road, Gatley SK8 4DZ (0161) 306 8330"
"Paul Clifton Paul Clifton Glanrhyd Uchaf, Boncath SA37 0JY (01239) 544620"
"Stephen Clymer Stephen Clymer 34 Cranbrook Road, Hounslow TW4 7BN (01784) 151546"
"Claire Cockram Claire Cockram 9 Dobson Street, Darwen BB3 1DU (01254) 672074"
"Andrew Cole Andrew Cole 38 Ullswater Crescent, Leeds LS15 0BP (0113) 430 1463"
"Jody Cole Jody Cole 86 Sandy Lane, Rochdale OL11 5DG (01706) 271831"
"Iain Coleman Iain Coleman 6 Shepherds Court, Hertford SG14 3HE (01920) 638523"
"Laurence Coles Laurence Coles 13 Cyprus Way, Newton Leys MK3 5GQ (01908) 043166"
"Karen Collier Karen Collier 15 Wigton Gardens, Stanmore HA7 1BG (01923) 737483"
"Christopher Cook Christopher Cook Flat 38, Jeygrove Court, 101 Hatton Garden, London EC1N 8LB (020) 1504 0033"
"Simon Cooney Simon Cooney 1 Brinns Cottages, 38 New Road, Sandhurst GU47 8EF (01276) 873421"
"Pete Cornes Pete Cornes 10 Greenwich Close, Maidstone ME16 0JA (01622) 674841"
"Vernon Courtney Vernon Courtney 46 Park Drive, Dagenham RM10 7AB (01708) 817706"
"Stephen Cowley Stephen Cowley 40 Smiths Road, Birchgrove SA7 9DY (01639) 376165"
"Duncan Cox Duncan Cox 1 Holm Oak Close, Bexhill-On-Sea TN39 3SF (01424) 248213"
"Timothy Craig Timothy Craig Brookside, Beals Mill PL17 8LR (01566) 133682"
"Virginia Crawley Virginia Crawley 3 Bethany Cottages, Trerulefoot PL12 5DE (01579) 077136"
"David Cree David Cree 89 Golden Grove, Southampton SO14 1RA (023) 3606 6254"
"John Davies John Davies 4 Barber Close, Great Totham CM9 8FL (01621) 316667"
"Marianne Dear Marianne Dear The Glyn, Rhosgoch LD2 3JR (01497) 430536"
"Tegwen Denslow Tegwen Denslow 78 Junction Road, Burgess Hill RH15 0JP (01444) 181341"
"John Divers John Divers Flat 1, 717 Christchurch Road, Boscombe BH7 6AF (01202) 508751"
"John Dixon John Dixon Flat 42, Shaftesbury Point, High Street, Plaistow E13 0AB (020) 8132 4232"
"Robert Dobson Robert Dobson The Old Smithy Cafe, Bridge Meadow Lane, Haverfordwest SA61 2EX (01437) 387660"
"Christopher Dodd Christopher Dodd Corner Cottage, Stretton En Le Field DE12 8AD (01827) 454331"
"Paul Duncombe Paul Duncombe 3 Mount Pleasant, Farnham GU9 7AA (01252) 802241"
"Lisa Dwyer Lisa Dwyer 8 Tyrone Road, Billericay CM11 2RU (01268) 373105"
"Graham Eaves Graham Eaves Flat 11, Old Ford Court, High Street, Pewsey SN9 5AG (01672) 337422"
"Michael Edwards Michael Edwards 10 Camberley Close, Sunderland SR3 2DF (0191) 245 6305"
"Aimee Eldridge Aimee Eldridge Flat 24, James Stroud House, Walworth Place, London SE17 2TQ (020) 7653 8121"
"Philip Elvin Philip Elvin 42 Augustine Avenue, Studley B80 7JL (01527) 007647"
"Simon Fahey Simon Fahey 8 Heol Ty Newydd, Cilgerran SA43 2RS (01239) 660502"
"Harvey Farrington Harvey Farrington Flat, 7A John Smeaton Court, Manchester M1 2NR (0161) 000 5000"
"Derek Faulkner Derek Faulkner 6 Leaside Close, Welwyn Garden City AL8 7DY (01707) 621400"
"Kathleen Ford Kathleen Ford Perran Round House, Rose TR4 9PG (01637) 610082"
"Jeremy Forsyth Jeremy Forsyth 18 Southview Close, Southwick BN42 4TX (01273) 834782"
"Molly Fowler Molly Fowler 9 Northfield Lane, Aldeburgh IP15 5NB (01728) 223817"
"Maria Fox Maria Fox 10 Colwick Park Close, Colwick NG4 2DZ (0115) 445 0736"
"Clive Franco Clive Franco 9 Kettlestone Road, Little Snoring NR21 0JQ (01328) 131155"
"Nicholas French Nicholas French 9 Alexandra Road, Eastbourne BN22 7PU (01323) 028527"
"Karl French Karl French 14 Osborne Avenue, Thornton-Cleveleys FY5 3PS (01253) 617766"
"Raymond Furby Raymond Furby 9 Beeches Avenue, Scunthorpe DN16 3QF (01724) 447505"
"Jacqueline Galea Jacqueline Galea 56 Holt Road, Horsford NR10 3DD (01603) 573644"
"Brendan Gardiner Brendan Gardiner 36 Fouracres Road, Manchester M23 1FE (0161) 167 7443"
"James Garner James Garner 19 Wrekin Close, Liverpool L25 8SP (01928) 605420"
"Derek Gayle Derek Gayle 25 Windrush Grove, Edgbaston B15 2DL (0121) 155 0027"
"Ruth George Ruth George 2 Glyn Road, Enfield EN3 4JL (01992) 375482"
"Colin Gilbert Colin Gilbert Cloud Cottage, 7 Church Lane, Moorhaven PL21 0XW (01548) 874758"
"Christine Goddard Christine Goddard 6 Almond House, Mulberry Walk, Fleet GU51 5EG (01252) 128771"
"Marc Gold Marc Gold Danesbury House, King Street, Abertillery NP13 1AD (01495) 701602"
"Peter Grady Peter Grady 52 Silkstone Road, Sheffield S12 4RL (0114) 414 0506"
"Nigel Gray Nigel Gray Acorn House, Great Stainton TS21 1NA (01740) 263386"
"Raymond Green Raymond Green 117 Higher Meadow, Leyland PR25 5RP (01257) 122781"
"Jamie Green Jamie Green 3 Holly Court, Newtown SY16 2QN (01686) 018815"
"Gerard Greene Gerard Greene 16 The Terrace, Rosebush SA66 7QX (01437) 851104"
"Alan Greenwood Alan Greenwood 203 Park Road, Heage DE56 2AB (01773) 684838"
"Anthony Hardie Anthony Hardie The Willows, Quarry Heath, Penkridge ST19 5RT (01543) 776383"
"Margaret Harding Margaret Harding 28 Percy Street, North Shields NE30 4HA (019467) 77383"
"Edward Harrison Edward Harrison 36 Albretia Avenue, Waterlooville PO8 8QS (01329) 263537"
"Joseph Harrison Joseph Harrison 26 Ospringe Street, Faversham ME13 8TN (01795) 604680"
"Martyn Harrison Martyn Harrison 5 Little Close, Arlesey SG15 6AB (01462) 610604"
"Samuel Haynes Samuel Haynes 115 Townshend Avenue, Plymouth PL2 1PB (01752) 282747"
"David Hayter David Hayter 5 Langthorne Crescent, Grays RM17 5XA (01375) 680032"
"Matthew Hedger Matthew Hedger 39 Highgate Lane, Bolton Upon Dearne S63 8HW (01709) 684735"
"Claire Hemmings Claire Hemmings 3 Marcham Row, Isabel Drive, Elsenham CM22 6YE (01279) 220364"
"Simon Hill Simon Hill 4 Elm Grove Road, Kidwelly SA17 4UA (01554) 511127"
"Victoria Holt Victoria Holt 7 Sunbury Close, Wilmslow SK9 3UD (01625) 134061"
"Mary Hull Mary Hull 9 Harringay Road, Birmingham B44 0UE (0121) 520 1865"
"Abdul Hussain Abdul Hussain Wellbank Camp, Bootle LA19 5TB (01229) 045452"
"Aftab Hussain Aftab Hussain 40 Audley Road, Chippenham SN14 0EH (01249) 418766"
"Mark Irving Mark Irving Wonder Cottage, Deal Road, Sandwich CT13 0BU (01843) 024244"








































































































































































































